Política,Deportes,Ciencia,Entretenimiento,Tecnología
"En Colombia la ley establece que es necesario que un porcentaje de los ciudadanos mayores de edad ejerzan el día de las elecciones presidenciales y territoriales las funciones de los jurados de votación. Esta medida es obligatoria para quienes son elegidos para el cargo, puesto que permite el ejercicio de la democracia.
De esta forma, los jurados de votación garantizan que se realice la jornada de los comicios electorales y que los demás colombianos puedan ejercer su derecho al voto. En caso de que los jurados de votación no cumplan con su deber, serán sancionados.
No obstante, los jurados de votación podrán evitar las sanciones. Esto solo en caso de que tengan una excusa válida ante el Estado sobre su ausencia en las mesas de votación para cumplir con su deber.
Ahora bien, de acuerdo a la ley hay varios motivos por los que los ciudadanos pueden ser exonerados de ser jurados de votación. “Conforme al artículo 108 del Código Electoral, son causales de exoneración las siguientes: Grave enfermedad del jurado o su cónyuge, padre, madre o hijo. Muerte del jurado o de su cónyuge, padre, madre o hijo, ocurrida el día de las elecciones o dentro de los tres días anteriores de la elección. No ser residente en el lugar donde fue designado. Ser menor de 18 años. Haberse inscrito y votar en otro municipio”","Navegando por las aguas turbulentas del deporte, comenzamos con la natación, donde los atletas deslizan sus cuerpos en el agua con la elegancia de delfines. Nadadores como Michael Phelps han dejado una huella imborrable en la historia olímpica, conquistando medallas de oro en una variedad de estilos de natación.","En un laboratorio de biotecnología, se ha logrado crear con éxito un órgano humano funcional utilizando impresión 3D y células madre. Este logro podría revolucionar los trasplantes de órganos al eliminar la necesidad de donantes y reducir significativamente los tiempos de espera. Los científicos esperan que esta tecnología avance y se pueda aplicar a una variedad de órganos en el futuro.","Practicar alguna habilidad juntos .Montar un taller de cocina donde los abuelos enseñen a sus nietos sus recetas favoritas adaptadas a su nivel o con los pequeños ejerciendo de pinches será una actividad entretenida y, además, productiva. También pueden practicar otra habilidad que interese a ambos, como aprender a tocar algún instrumento.

Las manualidades son otra excelente alternativa, para que ambos desarrollen su creatividad y dotes artísticas. Pintar sobre lienzos, hacer alfarería con kits caseros, manualidades con materiales reciclados… la imaginación al poder.

Pasear o hacer una excursión
Pasear al aire libre redunda en numerosos beneficios para niños y mayores, tanto física como mentalmente. Un paseo tranquilo por un parque o una zona de la naturaleza, o incluso montar en bicicleta, reforzará su conexión, observarán la fauna y flora, compartirán anécdotas y respirarán aire puro. También es buena idea organizar una excursión en clave cultural, por ejemplo a un museo o al teatro.

Contar historias, anécdotas y conocerse en profundidad
La vida de los mayores resulta fascinante a los pequeños y siempre quieren saber más sobre sus recuerdos y anécdotas. Podéis hacer uso de un álbum de fotos para que el abuelo narre las historias detrás de cada imagen, o bien que los niños preparen entrevistas para hacer a sus abuelos sobre lo que más curiosidad les despierte. En este sentido, existen libros especiales para que los abuelos y los nietos profundicen en su relación.

Jugar a juegos de mesa
Gustan a pequeños y mayores. Los juegos de mesa –ya sean de tablero, de cartas, de ingenio o de misterio– suponen un momento de entretenimiento, risas y diversión, brindando también la oportunidad de conversar durante el juego.","En 2019, una pintura creada por inteligencia artificial, inspirada en miles de retratos pintados entre los siglos XIV y XX, se vendió por casi 500.000 dólares en una subasta. Unos meses antes, los alumnos de un prestigioso conservatorio de música tuvieron muchísimas dificultades para diferenciar las notas musicales de Johann Sebastian Bach de las creadas por un algoritmo llamado Kulitta, que había sido programado para imitar el estilo del famoso compositor. Incluso la multinacional IBM se unió a la diversión y le encargó a su sistema Watson de inteligencia artificial que analizara 9.000 recetas para diseñar sus propias ideas culinarias."
"Como su nombre lo indica, se concentra en el apoyo legal que se brinda a todos los comerciantes en los asuntos propios de sus negocios, lo cual incluye, a  manera de ejemplo, desde el asesoramiento jurídico para el establecimiento de un vehículo de inversión en el país -una sociedad comercial o una sucursal de sociedad extranjera, hasta actividades más operativas como la planeación en la construcción y revisión de las operaciones, estructuras y negocios jurídicos tendientes al desarrollo de sus actividades comerciales y, en general, el acompañamiento para el cumplimiento de las obligaciones derivadas de su condición de comerciante e incluso hasta el cierre definitivo de su empresa. 
A través de la asesoría en derecho comercial, se dota al comerciante de las herramientas necesarias para proteger sus intereses, buscando que sus actividades empresariales se desarrollen en un ambiente de seguridad jurídica, previa la identificación de riesgos, y evitando ante todo la generación de conflictos cuyas consecuencias se pudieran traducir en complicados procesos judiciales o de cualquier otra naturaleza. 
En este contexto es importante mencionar que desde el momento en que una persona constituye su empresa o comienza a realizar actividades comerciales, se generan toda una serie de obligaciones legales corporativas, pero así mismo de carácter tributarias, laborales y en muchos casos de comercio internacional, por lo que resulta casi que obligatorio contar con consultores aliados expertos y con una visión integral que ofrezcan una asesoría especializada en todos estos campos con el fin de procurar la imposición de sanciones por el desconocimiento de la ley, que pudieran afectar a futuro a estabilidad jurídica, reputacional o incluso financiera del negocio. 
De manera general nos enfrentamos a conflictos ocasionados por incumplimientos contractuales o interpretaciones contradictorias entre los comerciantes. Por esto es relevante conocer los detalles y circunstancias propias de cada operación que se pretende realizar con anterioridad a la celebración y ejecución del respectivo negocio jurídico, con el fin de ajustar de manera precisa y de acuerdo con la situación especial los distintos documentos legales a suscribir y prever en todo caso aquellas circunstancias que la experiencia nos indica como las más susceptibles de generar conflictos y afectar una sana relación de negocios. 
A todas las personas ya sean naturales o jurídicas que desarrollen actividades comerciales en Colombia o incluso en el exterior o que pretendan hacerlo de conformidad con las normas vigentes y que deseen obtener provecho de las herramientas que ofrece un experto en materia legal corporativa integral. Para nosotros es claro que desde el emprendedor comienza a desarrollar una idea, hasta el empresario experimentado, requieren un asesor jurídico que, con visión integral del negocio y la actualidad jurídica, los apoyen en la identificación y minimización de riesgos, e identificación de los mecanismos jurídicos más adecuados a sus necesidades. ","En el vibrante mundo del deporte, cada disciplina es como una nota en una sinfonía, contribuyendo a una melodía de diversidad atlética que inspira a millones en todo el mundo. Desde el rugido de las multitudes en el estadio de fútbol hasta el susurro del viento en la pista de atletismo, cada deporte tiene su propio ritmo y pasión.",Científicos marinos han realizado un emocionante descubrimiento en las profundidades del océano. Han encontrado una nueva especie de criaturas bioluminiscentes que emiten una luz deslumbrante en las aguas oscuras. Este hallazgo arroja luz sobre la diversidad de la vida marina y su capacidad de adaptarse a entornos extremos.,"Muchas veces al hacernos mayores vamos abandonando la práctica de algunas actividades que en el pasado realizábamos por afición, para divertirnos o simplemente para pasar el rato. Las responsabilidades de la vida adulta acaban ocupando la mayor parte del tiempo y dejando a un lado esos momentos de desconexión, ya que los consideramos menos importantes. Sin embargo, se trata de un grave error. Y es que tener un hobby repercute de manera muy positiva en la salud.
El principal beneficio de tener un hobby es que nos ayuda a desconectar de manera importante de nuestro día a día. ""Al practicar un hobby estamos dedicando una parte de nuestro tiempo a ciertas actividades que no están relacionadas o son diferentes de las preocupaciones y problemas habituales que puede generarnos nuestra rutina, como la ansiedad Además, favorece el crecimiento y el desarrollo de nuestro potencial personal, ya que se trata de actividades que no realizamos con ningún fin económico, sino simplemente por el mero hecho de disfrutar de ellas.

Aparte de las responsabilidades diarias, hay otros motivos que evitan que realicemos algún hobby. Por ejemplo, algunas actividades que no requieren ningún esfuerzo (usar el móvil, mirar las redes sociales, ver la televisión, pedir comida a domicilio...) liberan mucha dopamina, un neurotransmisor que nos hace sentir bien. También impiden practicar aficiones la falta de planificación y no saber realmente lo que nos gusta.

Jugar al ajedrez: se trata de una estupenda opción para mantener en forma el cerebro. Este hobby retrasa los síntomas de enfermedades degenerativas y alivia el estrés o la depresión.
Leer un libro: mejora el vocabulario, la capacidad de pensamiento crítico, la confianza o la imaginación, además de ayudarnos a dormir por la noche.
Hacer crucigramas: con este hobby mejorarás tu vocabulario y tu concentración. Además, estimula la memoria y previene de enfermedades degenerativas.
Armar rompecabezas: aumenta la capacidad de concentración y la memoria. También ejercitarás la tolerancia a la frustración y combatirás el estrés.
Escuchar música: disminuye los niveles de estrés y ansiedad y alivia la depresión, además de estimular el sistema inmunológico del cuerpo.
Tocar un instrumento: el aprendizaje musical fomenta el desarrollo cognitivo. Además, te sentirás mejor contigo misma y estimularás la imaginación y la creatividad.
Bailar: la danza se trata de un excelente ejercicio cardiovascular, aumenta la resistencia y fortalece los huesos y los músculos. Además, también es recomendable para la salud del cerebro.
Jardinería: supone un ligero ejercicio aeróbico para trabajar los músculos y aumentar la fuerza. Al ser al aire libre, también previene la depresión y mejora el estado de ánimo. Otra ventaja es que se trata de un hobby perfecto para personas con movilidad reducida.
Escritura: mejora la memoria, reduce el estrés y favorece el sueño, además de contar con un gran potencial terapéutico.
Pilates: además de relajar, esta actividad tiene beneficios para el cuerpo. ""Mejora tanto la figura como la postura corporal"", explican desde la tienda online de material de gimnasio Fitfiu Fitness.
Tai chi: ""sus movimientos lentos ayudan a mejorar la fuerza muscular"", cuentan desde Sanitas. Además, aporta energía, favorece al sistema cardiovascular y al respiratorio, alivia el insomnio y mejora la hipertensión arterial.
Fotografía: la creación de imágenes puede contribuir a nuestro crecimiento personal. Existe incluso la fotografía terapéutica para lograr ese desarrollo y explorar procesos de autoconocimiento.
","Hace unos 66 millones de años un asteroide golpeó nuestro planeta y como consecuencia del impacto, del enfriamiento que se produjo en la Tierra, desaparecieron los dinosaurios. En 2022, un estudio llevado a cabo por investigadores del Instituto de Paleontología y Paleoantropología de Vertebrados (IVPP) de la Academia China de Ciencias respaldó la hipótesis que apuntaba a que los dinosaurios no eran muy diversos antes de extinguirse. Estos animales ya estaban en declive y se redujeron, en general, en el Cretácico."